{
  "$schema": "http://json-schema.org/draft-07/schema#",
  "title": "Entity Styles",
  "type": "object",
  "definitions": {
    "image": {
      "type": "object",
      "properties": {
        "uri": {
          "type": "string",
          "format": "uri"
        },
        "alt": {
          "type": "string"
        }
      },
      "required": [
        "uri",
        "alt"
      ]
    },
    "color": {
      "type": "object",
      "properties": {
        "color": {
          "type": "string",
          "pattern": "^#([A-Fa-f0-9]{6}|[A-Fa-f0-9]{3})$"
        }
      },
      "required": [
        "color"
      ]
    }
  },
  "properties": {
    "thumbnail": {
      "$ref": "#/definitions/image"
    },
    "hero": {
      "$ref": "#/definitions/image"
    },
    "background": {
      "$ref": "#/definitions/color"
    },
    "text": {
      "$ref": "#/definitions/color"
    }
  }
}