{
  "thumbnail": {
    "uri": "https://dol.wa.com/logo.png",
    "alt": "Washington State Seal"
  },
  "hero": {
    "uri": "https://dol.wa.com/people-working.png",
    "alt": "People working on serious things"
  },
  "background": {
    "color": "#ff0000"
  },
  "text": {
    "color": "#d4d400"
  }
}